{
  "requirement_id": "REQ-AUTH-017",
  "project_id": "example-product",
  "type": "FUNCTIONAL",
  "statement": "The system must rotate refresh tokens and detect reuse of a previously consumed refresh token.",
  "source_refs": [
    "SRC-PRD-0087"
  ],
  "priority": "MUST",
  "status": "CONFIRMED",
  "acceptance_summary": [
    "Reuse of a consumed refresh token is rejected",
    "Token family is revoked on reuse"
  ],
  "actors": [
    "end-user",
    "auth-service"
  ],
  "journey_ids": [
    "JRN-LOGIN"
  ],
  "constraints": [],
  "assumptions": [],
  "ambiguities": [],
  "verification_strategy": [
    "integration test",
    "e2e test"
  ],
  "related_task_ids": [
    "TSK-6FF57FCE58",
    "TSK-B3BC452716",
    "TSK-D59D71D1A0"
  ],
  "coverage_status": "COVERED",
  "dependencies": [],
  "risks": [
    "token theft"
  ],
  "notes": []
}
